<?xml version="1.0" encoding="utf-8" standalone="no" ?>
<piece xmlns:xsi="http://www.w3.org/2001/XMLSchema-instance" xsi:noNamespaceSchemaLocation="../../Source/schema/piece.xsd">
    <name>$l10n_piece_floorBasic</name>
    <price>400</price>
    <icon>placeables/baseplate/store_baseplate.dds</icon>
    <category>floor</category>

    <materials>
        <material fillType="CEMENTBRICKS" amount="1500" />
    </materials>

    <placementType>tile</placementType>
    <i3dFilename>models/floors/floorBasic.i3d</i3dFilename>
</piece>
